{
  "id": "CVE-2024-42479",
  "cve": "CVE-2024-42479",
  "aliases": [],
  "title": "llama.cpp (RPC backend): Unsafe `data` pointer in `rpc_tensor`",
  "layer": "ai-serving",
  "layer_name": "AI/ML frameworks & serving",
  "component": "llama.cpp (RPC backend)",
  "year": "2024",
  "cvss_score": 10.0,
  "severity": "critical",
  "kev": false,
  "impact": "Unsafe `data` pointer in `rpc_tensor` → arbitrary address write",
  "attack_vector": "Unauthenticated network to the llama.cpp RPC port on a distributed inference setup",
  "remediation": "Rebuild; the RPC backend has no authentication and must never be tenant-reachable",
  "references": [
    "https://nvd.nist.gov/vuln/detail/CVE-2024-42479"
  ],
  "status": "curated"
}
