{
  "id": "CVE-2024-10188",
  "cve": "CVE-2024-10188",
  "aliases": [],
  "title": "LiteLLM: Unauthenticated DoS via `ast.literal_eval` on user input",
  "layer": "ai-serving",
  "layer_name": "AI/ML frameworks & serving",
  "component": "LiteLLM",
  "year": "2024",
  "cvss_score": 7.5,
  "severity": "high",
  "kev": false,
  "impact": "Unauthenticated DoS via `ast.literal_eval` on user input",
  "attack_vector": "Unauthenticated network",
  "remediation": "Upgrade",
  "references": [
    "https://nvd.nist.gov/vuln/detail/CVE-2024-10188"
  ],
  "status": "curated"
}
