{
  "cvss_vector": "CVSS:3.1/AV:L/AC:L/PR:N/UI:N/S:U/C:H/I:H/A:H",
  "fleet": {
    "pain_class": "daemon-restart"
  },
  "id": "CVE-2026-65119",
  "cve": "CVE-2026-65119",
  "aliases": [],
  "title": "NVIDIA TensorRT-LLM: untrusted tokenizer loading in KvCacheAwareRouter can execute code",
  "layer": "ai-serving",
  "layer_name": "AI/ML frameworks & serving",
  "component": "NVIDIA TensorRT-LLM (KvCacheAwareRouter tokenizer loading)",
  "year": "2026",
  "cvss_score": 8.4,
  "severity": "high",
  "kev": false,
  "impact": "TensorRT-LLM's KvCacheAwareRouter loads a tokenizer from a location an attacker can influence, pulling in functionality from an untrusted control sphere. NVIDIA states a successful exploit may lead to code execution, information disclosure, data tampering and denial of service. On a GPU serving fleet this means the inference process - which holds the GPU, the loaded weights and whatever credentials the serving pod carries - can be made to run attacker code. The CVSS vector is local (AV:L) with no privileges required, so the realistic path is a tenant or pipeline that controls the model or tokenizer artifacts the router is pointed at.",
  "attack_vector": "Local to the serving host or control over the tokenizer/model artifact that TensorRT-LLM loads. No authentication required per the CVSS vector (PR:N); user interaction not required.",
  "remediation": "Upgrade TensorRT-LLM to the fixed version listed in NVIDIA bulletin 5883 and restart the inference servers. This is a userspace serving component, so a rolling restart of the serving deployment is enough - no node reboot or firmware work. Until then, treat tokenizer and model artifact paths as privileged and restrict who can write them.",
  "references": [
    "https://nvd.nist.gov/vuln/detail/CVE-2026-65119",
    "https://github.com/NVIDIA/product-security/tree/main/2026/5883",
    "https://www.cve.org/CVERecord?id=CVE-2026-65119"
  ],
  "status": "curated"
}
