{
  "cvss_vector": "CVSS:4.0/AV:N/AC:L/AT:N/PR:N/UI:N/VC:H/VI:H/VA:H/SC:N/SI:N/SA:N/E:X/CR:X/IR:X/AR:X/MAV:X/MAC:X/MAT:X/MPR:X/MUI:X/MVC:X/MVI:X/MVA:X/MSC:X/MSI:X/MSA:X/S:X/AU:X/R:X/V:X/RE:X/U:X",
  "fleet": {
    "pain_class": "daemon-restart"
  },
  "id": "CVE-2026-61459",
  "cve": "CVE-2026-61459",
  "aliases": [],
  "title": "mcp-server-kubernetes: leading-dash arguments inject --server and leak the operator's kubeconfig token",
  "layer": "container-orchestration",
  "layer_name": "Container, Kubernetes & orchestration",
  "component": "mcp-server-kubernetes (kubectl_get / kubectl_describe / kubectl_delete argument handling)",
  "year": "2026",
  "cvss_score": 9.3,
  "severity": "critical",
  "kev": false,
  "impact": "The structured kubectl tools accept resourceType and name values beginning with a dash, slipping past assertNoDangerousFlags, so an attacker who controls those tool arguments can inject --server and point kubectl at an API server they run. The operator's bearer token from the loaded kubeconfig is then sent to that endpoint. Because an MCP server of this kind usually runs with a cluster-admin or near-admin kubeconfig, the stolen credential is full control of the cluster: scheduling pods on GPU nodes, reading every namespace's secrets, and draining or relabelling nodes. The arguments come from an LLM, so untrusted content the agent reads - a pod log, an issue body, a manifest - is enough to drive the injection. Fixed in 3.9.0.",
  "attack_vector": "Anyone who can influence the arguments the agent passes to these tools: a prompt-injection payload in content the agent processes, or any user permitted to talk to the MCP server. No Kubernetes credentials of their own are needed - the point of the bug is that they borrow the server's.",
  "remediation": "Upgrade mcp-server-kubernetes to 3.9.0 or later and restart the MCP server process. Treat the kubeconfig the server loaded as exposed if it was reachable by untrusted input: rotate that service account token or client credential and review the API server audit log for requests from unexpected sources. Scope the server's kubeconfig to the least privilege it can work with rather than cluster-admin.",
  "references": [
    "https://nvd.nist.gov/vuln/detail/CVE-2026-61459",
    "https://www.vulncheck.com/advisories/mcp-server-kubernetes-argument-injection-via-kubectl-structured-tools",
    "https://github.com/Flux159/mcp-server-kubernetes/commit/d7890f50a4567bf5d9842541ba6f41e180227f9a",
    "https://github.com/Flux159/mcp-server-kubernetes/releases/tag/3.9.0"
  ],
  "status": "curated"
}
