{
  "cvss_vector": "CVSS:3.1/AV:P/AC:H/PR:N/UI:N/S:U/C:H/I:H/A:H",
  "fleet": {
    "pain_class": "node-reboot"
  },
  "id": "CVE-2026-47586",
  "cve": "CVE-2026-47586",
  "aliases": [],
  "title": "NVIDIA GPU driver: use-after-free in the kernel module, scored as requiring physical access",
  "layer": "gpu-stack",
  "layer_name": "NVIDIA / GPU stack",
  "component": "NVIDIA GPU Display Driver kernel module (use-after-free)",
  "year": "2026",
  "cvss_score": 6.4,
  "severity": "medium",
  "kev": false,
  "impact": "A use-after-free in the GPU driver kernel module with code execution, privilege escalation, information disclosure, data tampering and denial of service listed. NVIDIA scored it AV:P with no privileges required, meaning the trigger needs physical access to the machine rather than a tenant workload - in a datacenter that is cage access or a maintenance hand, not a remote attacker. Worth patching on the regular driver cycle; not a reason to open a window tonight unless your threat model includes people at the rack.",
  "attack_vector": "Physical access to the host (AV:P), no authentication required, high attack complexity.",
  "remediation": "Update the GPU display driver to the fixed branch in NVIDIA bulletin 2026/5861 on your normal driver cycle. The update requires a node drain and reboot to swap the kernel module.",
  "references": [
    "https://nvd.nist.gov/vuln/detail/CVE-2026-47586",
    "https://github.com/NVIDIA/product-security/tree/main/2026/5861",
    "https://www.cve.org/CVERecord?id=CVE-2026-47586"
  ],
  "status": "curated"
}
