{
  "id": "CVE-2023-40238",
  "cve": "CVE-2023-40238",
  "aliases": [
    "LogoFAIL"
  ],
  "title": "Insyde InsydeH2O BmpDecoderDxe: Crafted BMP logo copies data to a chosen address during DXE",
  "layer": "firmware-bmc-fabric",
  "layer_name": "Firmware, BMC & network fabric",
  "component": "Insyde InsydeH2O BmpDecoderDxe",
  "year": "2023",
  "cvss_score": 5.5,
  "severity": "medium",
  "kev": false,
  "impact": "Crafted BMP logo copies data to a chosen address during DXE — arbitrary write before Secure Boot",
  "attack_vector": "Local, ESP write",
  "remediation": "Insyde kernel update shipped through each OEM; the CVSS understates it because the outcome is a firmware implant",
  "references": [
    "https://nvd.nist.gov/vuln/detail/CVE-2023-40238"
  ],
  "status": "curated"
}
