{
  "cvss_vector": "CVSS:3.1/AV:L/AC:L/PR:L/UI:N/S:U/C:H/I:H/A:H",
  "fleet": {
    "pain_class": "node-reboot"
  },
  "id": "CVE-2026-47493",
  "cve": "CVE-2026-47493",
  "aliases": [],
  "title": "NVIDIA vGPU: a guest can reach privileged host GPU resources it is not authorized for",
  "layer": "gpu-stack",
  "layer_name": "NVIDIA / GPU stack",
  "component": "NVIDIA vGPU software (GPU kernel driver, guest access to host GPU resources)",
  "year": "2026",
  "cvss_score": 7.8,
  "severity": "high",
  "kev": false,
  "impact": "A guest VM reaches host GPU resources that should be off limits to it, which is a direct break of the boundary vGPU exists to enforce. For a provider selling vGPU slices, that boundary is the product: a tenant VM touching host-side resources can affect or observe the GPU state of other VMs on the same physical board. The host has to be patched for this, not just the guest, so the maintenance falls on the hypervisor fleet.",
  "attack_vector": "From inside a guest VM with a vGPU assigned. Authenticated as a normal user of that VM; no host credentials are needed.",
  "remediation": "Update the Virtual GPU Manager on every hypervisor host to the version NVIDIA lists in bulletin 2026/5861; the record gives no version number. Updating the vGPU Manager means migrating or shutting down every VM on the host and rebooting it, so plan this as a rolling host-by-host drain across the vGPU fleet.",
  "references": [
    "https://nvd.nist.gov/vuln/detail/CVE-2026-47493",
    "https://github.com/NVIDIA/product-security/tree/main/2026/5861",
    "https://www.cve.org/CVERecord?id=CVE-2026-47493"
  ],
  "status": "curated"
}
