{
  "id": "CVE-2024-24557",
  "cve": "CVE-2024-24557",
  "aliases": [],
  "title": "Docker / moby: Classic builder cache poisoning for images built FROM scratch",
  "layer": "container-orchestration",
  "layer_name": "Container, Kubernetes & orchestration",
  "component": "Docker / moby",
  "year": "2024",
  "cvss_score": 6.9,
  "severity": "medium",
  "kev": false,
  "impact": "Classic builder cache poisoning for images built FROM scratch",
  "attack_vector": "Anyone sharing a build cache, e.g. a multi-tenant CI builder",
  "remediation": "Upgrade moby; give each tenant an isolated build cache",
  "references": [
    "https://nvd.nist.gov/vuln/detail/CVE-2024-24557"
  ],
  "status": "curated"
}
