{
  "cvss_vector": "CVSS:3.1/AV:N/AC:L/PR:N/UI:N/S:U/C:H/I:H/A:H",
  "fleet": {
    "pain_class": "node-reboot"
  },
  "id": "CVE-2019-9169",
  "cve": "CVE-2019-9169",
  "aliases": [],
  "title": "glibc through 2.29: heap buffer over-read in regexec during case-insensitive regex matching",
  "layer": "kernel-hypervisor",
  "layer_name": "Kernel, userspace & hypervisor",
  "component": "glibc regexec (proceed_next_node, case-insensitive matching)",
  "year": "2019",
  "cvss_score": 9.8,
  "severity": "critical",
  "kev": false,
  "impact": "proceed_next_node in glibc's regexec reads past the end of a heap buffer on an attempted case-insensitive regular-expression match, in all versions through 2.29. Any service on the host that compiles or matches an attacker-influenced pattern with the system regex functions can be made to over-read, which in practice means a crash or small adjacent-memory disclosure in that process rather than code execution; nothing in the record shows a write. On a GPU fleet the plausible callers are log processors, access-control rules and admission or policy tooling that accept patterns from users. Only very old glibc is affected - a current host is not exposed, which makes this useful mainly as an audit item for long-lived management appliances and vendor-embedded Linux images.",
  "attack_vector": "Requires a process on the host that passes an attacker-influenced pattern or subject into regexec with case-insensitive matching, on glibc 2.29 or older. Whether authentication is needed depends on that process.",
  "remediation": "Move to glibc 2.30 or later, or apply the distribution backport (Gentoo GLSA 202006-04; the glibc bug reports are 34140 and 34142). Any glibc replacement requires restarting every linked process, so expect a drain and reboot per node. For appliances and embedded images that cannot be upgraded independently, the vendor update is the only route.",
  "references": [
    "https://nvd.nist.gov/vuln/detail/CVE-2019-9169",
    "https://debbugs.gnu.org/cgi/bugreport.cgi?bug=34140",
    "https://debbugs.gnu.org/cgi/bugreport.cgi?bug=34142",
    "https://security.gentoo.org/glsa/202006-04"
  ],
  "status": "curated"
}
