{
  "id": "CVE-2023-6021",
  "cve": "CVE-2023-6021",
  "aliases": [],
  "title": "Ray (log API): LFI — read any file on the head node, unauthenticated",
  "layer": "ai-serving",
  "layer_name": "AI/ML frameworks & serving",
  "component": "Ray (log API)",
  "year": "2023",
  "cvss_score": 7.5,
  "severity": "high",
  "kev": false,
  "impact": "LFI — read any file on the head node, unauthenticated",
  "attack_vector": "Unauthenticated network to the dashboard",
  "remediation": "Upgrade to 2.8.1+; head-node secrets and cloud credentials are in scope",
  "references": [
    "https://nvd.nist.gov/vuln/detail/CVE-2023-6021"
  ],
  "status": "curated"
}
