{
  "id": "CVE-2025-23334",
  "cve": "CVE-2025-23334",
  "aliases": [],
  "title": "NVIDIA Triton Inference Server: MULTI-TENANT ISOLATION: a crafted request causes an out-of-bounds read in the Python backend, disclosing…",
  "layer": "gpu-stack",
  "layer_name": "NVIDIA / GPU stack",
  "component": "NVIDIA Triton Inference Server",
  "year": "2025",
  "cvss_score": 5.9,
  "severity": "medium",
  "kev": false,
  "impact": "MULTI-TENANT ISOLATION: a crafted request causes an out-of-bounds read in the Python backend, disclosing memory that can include co-resident request data. On a shared inference tier this is a noisy-neighbour weapon: one tenant's request kills the server process and takes every co-resident model with it, and the GPU sits idle until the pod restarts.",
  "attack_vector": "Network. Anyone who can reach the Triton HTTP or gRPC endpoint. In most clusters that is anything on the pod network; where ingress is loosely scoped it is the internet. No authentication step exists in Triton itself to stop it.",
  "remediation": "Roll to the fixed Triton container image per bulletin 5687. Cost: an ordinary rolling deployment restart - no driver, firmware or node change. Worth pairing with an audit of Triton endpoint exposure, since almost every bug in this component is only interesting because the endpoint is reachable.",
  "references": [
    "https://nvd.nist.gov/vuln/detail/CVE-2025-23334",
    "https://github.com/NVIDIA/product-security/tree/main/2025/5687"
  ],
  "status": "curated",
  "cvss_vector": "CVSS:3.1/AV:N/AC:H/PR:N/UI:N/S:U/C:H/I:N/A:N",
  "cwe": [
    "CWE-125"
  ]
}
