{
  "cvss_vector": "CVSS:3.1/AV:N/AC:L/PR:N/UI:N/S:U/C:H/I:H/A:H",
  "cwe": [
    "CWE-416",
    "CWE-362"
  ],
  "fleet": {
    "pain_class": "node-reboot"
  },
  "id": "CVE-2022-49003",
  "cve": "CVE-2022-49003",
  "aliases": [],
  "title": "Linux kernel (drivers/nvme/host): The multipath sibling list is walked without SRCU protection during path revalidation",
  "layer": "kernel-hypervisor",
  "layer_name": "Kernel, userspace & hypervisor",
  "component": "Linux kernel (drivers/nvme/host)",
  "year": "2022",
  "cvss_score": 9.8,
  "severity": "critical",
  "kev": false,
  "impact": "The multipath sibling list is walked without SRCU protection during path revalidation while concurrent scan work frees namespaces out from under it, giving a use-after-free on the initiator. The reported panic came from a live NVMe/RDMA multipath setup - the node dies and takes every tenant on it.",
  "attack_vector": "Initiator-side, driven by the remote target: namespace-change async event notifications are what schedule scan work, and the target decides when and how often to send them. A target that a tenant controls, or one an attacker has compromised, can spray namespace-change AENs and capacity changes to force the concurrent revalidate/remove race. Requires native NVMe multipath enabled (the default) with a fabric transport.",
  "remediation": "No fixed version is listed on this record - boot a kernel carrying the linked stable commits. Interim: only connect initiators to targets you operate, and treat a node emitting repeated capacity-change/rescan events as suspect - drain it.",
  "references": [
    "https://git.kernel.org/stable/c/787d81d4eb150e443e5d1276c6e8f03cfecc2302",
    "https://git.kernel.org/stable/c/5b566d09ab1b975566a53f9c5466ee260d087582",
    "https://nvd.nist.gov/vuln/detail/CVE-2022-49003"
  ],
  "status": "curated",
  "tags": [
    "tenant-isolation"
  ]
}
