{
  "id": "CVE-2025-33176",
  "cve": "CVE-2025-33176",
  "aliases": [],
  "title": "NVIDIA Run:ai: Improper restriction of communication channels lets an attacker on an adjacent network reach privilege…",
  "layer": "gpu-stack",
  "layer_name": "NVIDIA / GPU stack",
  "component": "NVIDIA Run:ai",
  "year": "2025",
  "cvss_score": 6.2,
  "severity": "medium",
  "kev": false,
  "impact": "Improper restriction of communication channels lets an attacker on an adjacent network reach privilege escalation, data tampering and information disclosure in the Run:ai scheduler. Run:ai is the component deciding which tenant's job lands on which GPU, so control over it is control over the fleet's allocation and quota model.",
  "attack_vector": "Adjacent network, low privileges, user interaction, high complexity. A tenant workload or a compromised pod inside the cluster network.",
  "remediation": "Upgrade Run:ai per bulletin 5719. Cost: a control-plane upgrade - the scheduler restarts, queued jobs pause, running jobs keep their GPUs. Plan it in a low-submission window rather than draining nodes.",
  "references": [
    "https://nvd.nist.gov/vuln/detail/CVE-2025-33176",
    "https://github.com/NVIDIA/product-security/tree/main/2025/5719"
  ],
  "status": "curated",
  "cvss_vector": "CVSS:3.1/AV:A/AC:H/PR:L/UI:R/S:C/C:L/I:H/A:N",
  "cwe": [
    "CWE-923"
  ]
}
