{
  "id": "CVE-2025-20087",
  "cve": "CVE-2025-20087",
  "aliases": [],
  "title": "Intel oneAPI DPC++/C++ compiler installer: The compiler installer sets permissions that let a local user modify installed files that later execute with…",
  "layer": "firmware-bmc-fabric",
  "layer_name": "Firmware, BMC & network fabric",
  "component": "Intel oneAPI DPC++/C++ compiler installer",
  "year": "2025",
  "cvss_score": 6.7,
  "severity": "medium",
  "kev": false,
  "impact": "The compiler installer sets permissions that let a local user modify installed files that later execute with higher privilege. Same practical outcome as the search-path family: local privilege escalation on shared build and training nodes.",
  "attack_vector": "A local authenticated user on a node that has the toolkit installed. On shared build/dev nodes and on container images built from the Intel toolkits, that is a broad set of people.",
  "remediation": "Upgrade the affected component and, just as importantly, audit directory permissions on already-provisioned nodes and container images - upgrading the package does not remove a writable directory an earlier install created. Userspace only: no reboot, no BIOS, no microcode. Rebuild base images rather than patching running nodes.",
  "references": [
    "https://nvd.nist.gov/vuln/detail/CVE-2025-20087",
    "https://www.intel.com/content/www/us/en/security-center/advisory/intel-sa-01285.html"
  ],
  "status": "curated"
}
