{
  "id": "CVE-2026-47614",
  "cve": "CVE-2026-47614",
  "aliases": [],
  "title": "NVIDIA Dynamo: SSRF in remote resource loading",
  "layer": "gpu-stack",
  "layer_name": "NVIDIA / GPU stack",
  "component": "NVIDIA Dynamo",
  "year": "2026",
  "cvss_score": 7.5,
  "severity": "high",
  "kev": false,
  "impact": "SSRF in remote resource loading",
  "attack_vector": "Tenant-supplied model URI",
  "remediation": "Bump Dynamo; add egress policy",
  "references": [
    "https://nvd.nist.gov/vuln/detail/CVE-2026-47614",
    "https://github.com/NVIDIA/product-security/tree/main/2026/5842"
  ],
  "status": "curated",
  "cvss_vector": "CVSS:3.1/AV:N/AC:L/PR:N/UI:N/S:U/C:H/I:N/A:N",
  "cwe": [
    "CWE-918"
  ]
}
