{
  "cvss_vector": "CVSS:4.0/AV:N/AC:L/AT:N/PR:N/UI:N/VC:H/VI:H/VA:H/SC:L/SI:L/SA:L/E:X/CR:X/IR:X/AR:X/MAV:X/MAC:X/MAT:X/MPR:X/MUI:X/MVC:X/MVI:X/MVA:X/MSC:X/MSI:X/MSA:X/S:X/AU:X/R:X/V:X/RE:X/U:X",
  "fleet": {
    "pain_class": "node-reboot"
  },
  "id": "CVE-2026-19490",
  "cve": "CVE-2026-19490",
  "aliases": [],
  "title": "Citrix NetScaler ADC and Gateway: unauthenticated remote compromise of the appliance",
  "layer": "control-plane",
  "layer_name": "Control plane, storage & DevOps",
  "component": "Citrix NetScaler ADC / Gateway",
  "year": "2026",
  "cvss_score": 9.3,
  "severity": "critical",
  "kev": true,
  "impact": "Citrix describes only \"a vulnerability\" in NetScaler ADC and Gateway, but the scoring is unauthenticated, network-reachable, with high confidentiality, integrity and availability impact on the appliance and some spillover to systems behind it, and CISA lists it as exploited in the wild. Where NetScaler fronts a datacenter as the load balancer or the remote-access gateway, an attacker who takes it owns the TLS termination point, the session material for everyone logging in, and a foothold that sits between the internet and the cluster. Affected: ADC and Gateway 14.1 before 73.32 and 13.1 before 63.21. The record carries no technical detail at all - the mechanism, the affected feature and the preconditions are unknown from public data, so treat the exposure as broad until Citrix says otherwise.",
  "attack_vector": "Network, unauthenticated, no user interaction per the CVSS 4.0 vector. The record does not say which virtual server type or feature must be configured, so assume any reachable NetScaler on an affected build is in scope.",
  "remediation": "Move to a fixed build per Citrix CTX696939 (14.1-73.32 or later, 13.1-63.21 or later on those branches). This is an appliance image upgrade and reboot rather than a package update: do it one HA node at a time and expect established sessions to drop. Given active exploitation, upgrading is not sufficient on its own - rotate credentials and session secrets the appliance held and review it for persistence, as Citrix has advised for prior exploited NetScaler flaws. Builds outside the two listed branches are end-of-life and get no fix.",
  "references": [
    "https://nvd.nist.gov/vuln/detail/CVE-2026-19490",
    "https://support.citrix.com/support-home/kbsearch/article?articleNumber=CTX696939",
    "https://www.cisa.gov/known-exploited-vulnerabilities-catalog?field_cve=CVE-2026-19490"
  ],
  "status": "curated"
}
