{
  "id": "CVE-2025-23253",
  "cve": "CVE-2025-23253",
  "aliases": [],
  "title": "NVIDIA App: Local privesc",
  "layer": "gpu-stack",
  "layer_name": "NVIDIA / GPU stack",
  "component": "NVIDIA App",
  "year": "2025",
  "cvss_score": 8.8,
  "severity": "high",
  "kev": false,
  "impact": "Local privesc",
  "attack_vector": "Local Windows user",
  "remediation": "Consumer app; no DC action",
  "references": [
    "https://raw.githubusercontent.com/NVIDIA/product-security/main/2025/CVE_index.csv"
  ],
  "status": "curated"
}
