{
  "cvss_vector": "CVSS:3.1/AV:L/AC:L/PR:L/UI:N/S:U/C:H/I:N/A:H",
  "cwe": [
    "CWE-125",
    "CWE-20"
  ],
  "fleet": {
    "pain_class": "node-reboot"
  },
  "id": "CVE-2026-68420",
  "cve": "CVE-2026-68420",
  "aliases": [],
  "title": "Linux kernel (net/xfrm): Outbound policies rejected optional tunnel and BEET templates but never got the same check for",
  "layer": "kernel-hypervisor",
  "layer_name": "Kernel, userspace & hypervisor",
  "component": "Linux kernel (net/xfrm)",
  "year": "2026",
  "cvss_score": 7.1,
  "severity": "high",
  "kev": false,
  "impact": "Outbound policies rejected optional tunnel and BEET templates but never got the same check for IPTFS, so an IPTFS template marked 'level use' walks past the end of the template address array during outbound resolution. The result is a stack out-of-bounds read used to pick a security association - kernel stack contents leaked into SA selection, and a crash when the read lands badly. A tenant able to install policies gets both an information-disclosure primitive and a node crash.",
  "attack_vector": "Two commands and a ping, per the upstream reproducer: install an outbound policy whose first template is 'mode iptfs level use', then send any packet matching the selector. That needs the ability to write xfrm policy - host root, or a tenant container holding CAP_NET_ADMIN in its own user+network namespace. Inbound and forward policies are unaffected. Conditional on IPTFS support being present in the kernel.",
  "remediation": "Boot a kernel carrying the fix commits below (no fixed stable version published). Interim control: do not grant CAP_NET_ADMIN inside tenant user namespaces; if tenants must program IPsec, reject templates with mode iptfs and level use in whatever admission layer sits in front of the xfrm netlink socket.",
  "references": [
    "https://git.kernel.org/stable/c/d7fc6f351c478586980a521d63b0214d9c055e78",
    "https://git.kernel.org/stable/c/9333f4b6f44858fc98eb12bf26b8d2959eb975d5",
    "https://nvd.nist.gov/vuln/detail/CVE-2026-68420"
  ],
  "status": "curated",
  "tags": [
    "tenant-isolation"
  ]
}
