{
  "id": "CVE-2024-44933",
  "cve": "CVE-2024-44933",
  "aliases": [],
  "title": "Linux bnxt_en driver (bnxt_fill_hw_rss_tbl): Memory out-of-bounds in the RSS indirection-table path of the Broadcom NIC driver, giving kernel panic…",
  "layer": "firmware-bmc-fabric",
  "layer_name": "Firmware, BMC & network fabric",
  "component": "Linux bnxt_en driver (bnxt_fill_hw_rss_tbl)",
  "year": "2024",
  "cvss_score": 7.3,
  "severity": "high",
  "kev": false,
  "impact": "Memory out-of-bounds in the RSS indirection-table path of the Broadcom NIC driver, giving kernel panic, denial of service, or an information leak out of kernel memory. The information-leak arm is the one that matters for multi-tenancy — kernel memory on a shared host contains other workloads' data.",
  "attack_vector": "Reachable through ring-reservation and RSS configuration paths in the driver; local host privilege or specific traffic conditions depending on the trigger.",
  "remediation": "Kernel/driver upgrade and host reboot. Rolling across the fleet during normal maintenance; no firmware flash needed.",
  "references": [
    "https://nvd.nist.gov/vuln/detail/CVE-2024-44933"
  ],
  "status": "curated",
  "fleet": {
    "pain_class": "node-reboot"
  }
}
