{
  "cvss_vector": "CVSS:3.1/AV:N/AC:L/PR:N/UI:N/S:U/C:L/I:N/A:N",
  "fleet": {
    "pain_class": "daemon-restart"
  },
  "id": "CVE-2026-73511",
  "cve": "CVE-2026-73511",
  "aliases": [],
  "title": "Envoy: semicolon path parameters make routing pick an unprotected route for a protected resource",
  "layer": "container-orchestration",
  "layer_name": "Container, Kubernetes & orchestration",
  "component": "Envoy HTTP path matching (ignore_path_parameters_in_path_matching, semicolon matrix parameters)",
  "year": "2026",
  "cvss_score": 5.3,
  "severity": "medium",
  "kev": false,
  "impact": "Envoy matches the raw request path, while servlet backends such as Tomcat strip semicolon matrix parameters per path segment before resolving a resource. The `ignore_path_parameters_in_path_matching` option truncates at the first semicolon instead, which still does not reproduce the backend's per-segment behaviour. A remote client can attach a parameter to a protected segment, or to an earlier segment, so Envoy selects an unprotected fallback route while the backend serves the protected resource - an authorization bypass for any policy expressed as a path match. This matters wherever Envoy is the ingress or mesh sidecar in front of cluster services: a path-based allow rule in front of an internal API or model endpoint can be stepped around without credentials.",
  "attack_vector": "Any remote client that can send HTTP requests to the Envoy listener. No authentication needed. Exposure requires both a path-based Envoy authorization decision and a backend that strips semicolon parameters per segment.",
  "remediation": "Upgrade Envoy to 1.36.10, 1.37.6, 1.38.4, or 1.39.1 and restart or hot-restart the proxies; for sidecars this is a rolling pod restart, for ingress a rolling replace behind the load balancer - no node drain. If an upgrade has to wait, stop relying on raw-path matching for authorization: reject requests containing `;` at the edge, or enforce authorization in the backend.",
  "references": [
    "https://nvd.nist.gov/vuln/detail/CVE-2026-73511",
    "https://github.com/envoyproxy/envoy/releases/tag/v1.36.10",
    "https://github.com/envoyproxy/envoy/commit/50f7bfa48dccfee339822e9846b2b8053e07d325",
    "https://github.com/envoyproxy/envoy/commit/b205d1f4982e14ce5693ba94ef84d37e7155e050"
  ],
  "status": "curated"
}
